{
  "run_id": "regression_run:topological-phases-core-2026-03-19",
  "suite_id": "regression_suite:topological-phases-core",
  "status": "mixed",
  "results": [
    {
      "question_id": "regression_question:define-weyl-node-with-assumptions",
      "oracle_id": "question_oracle:define-weyl-node-with-assumptions",
      "grade": "pass",
      "notes": "The local Weyl definition branch remains explicit and formula-bearing."
    },
    {
      "question_id": "regression_question:reconstruct-local-weyl-linearization",
      "oracle_id": "question_oracle:reconstruct-local-weyl-linearization",
      "grade": "pass",
      "notes": "The local Weyl derivation is still decomposed into explicit derivation-step units."
    },
    {
      "question_id": "regression_question:prove-nielsen-ninomiya-by-stokes",
      "oracle_id": "question_oracle:prove-nielsen-ninomiya-by-stokes",
      "grade": "partial",
      "notes": "The local theorem proof is explicit, but the stronger Friedan cited-paper route is still unresolved.",
      "writeback_unit_ids": [
        "open_gap:friedan-level-rigorous-nielsen-ninomiya-proof-not-yet-ingested",
        "followup_source_task:ingest-friedan-proof-of-nielsen-ninomiya"
      ]
    },
    {
      "question_id": "regression_question:explain-berry-flux-version-of-node-charge",
      "oracle_id": "question_oracle:explain-berry-flux-version-of-node-charge",
      "grade": "pass",
      "notes": "The Berry-curvature route to the node charge and zero-sum law is explicit."
    },
    {
      "question_id": "regression_question:separate-anomaly-intuition-from-lattice-proof",
      "oracle_id": "question_oracle:separate-anomaly-intuition-from-lattice-proof",
      "grade": "partial",
      "notes": "The local distinction is explicit, but the cited-source separation between anomaly intuition and lattice proof is still incomplete.",
      "writeback_unit_ids": [
        "open_gap:parity-anomaly-motivates-but-does-not-prove-lattice-no-go",
        "followup_source_task:ingest-friedan-proof-of-nielsen-ninomiya",
        "followup_source_task:ingest-callan-harvey-and-jackiw-rebbi-for-edge-mode-proof"
      ]
    },
    {
      "question_id": "regression_question:reconstruct-hall-response-chern-number-equivalence",
      "oracle_id": "question_oracle:reconstruct-hall-response-chern-number-equivalence",
      "grade": "pass",
      "notes": "The Hall-response, band-Chern, and many-body twist-angle equality can now be reconstructed explicitly from the current canonical family."
    },
    {
      "question_id": "regression_question:derive-jackiw-rebbi-edge-mode-from-mass-sign-change",
      "oracle_id": "question_oracle:derive-jackiw-rebbi-edge-mode-from-mass-sign-change",
      "grade": "pass",
      "notes": "The sign-changing-mass edge-mode theorem is derivable locally, even though the original Jackiw-Rebbi and Callan-Harvey sources still remain queued for recovery."
    }
  ],
  "created_at": "2026-03-19"
}
