{
  "run_id": "regression_run:topological-phases-core-2026-03-20-proof-grade-closure",
  "suite_id": "regression_suite:topological-phases-core",
  "status": "mixed",
  "topic_completion_status": "promotion-blocked",
  "promotion_readiness": "blocked",
  "blocking_unit_ids": [
    "open_gap:friedan-level-rigorous-nielsen-ninomiya-proof-not-yet-ingested",
    "open_gap:parity-anomaly-motivates-but-does-not-prove-lattice-no-go",
    "followup_source_task:ingest-friedan-proof-of-nielsen-ninomiya",
    "followup_source_task:ingest-callan-harvey-and-jackiw-rebbi-for-edge-mode-proof"
  ],
  "results": [
    {
      "question_id": "regression_question:define-weyl-node-with-assumptions",
      "oracle_id": "question_oracle:define-weyl-node-with-assumptions",
      "grade": "pass",
      "notes": "The local Weyl definition branch remains explicit and formula-bearing."
    },
    {
      "question_id": "regression_question:reconstruct-local-weyl-linearization",
      "oracle_id": "question_oracle:reconstruct-local-weyl-linearization",
      "grade": "pass",
      "notes": "The local Weyl derivation is still decomposed into explicit derivation-step units."
    },
    {
      "question_id": "regression_question:prove-nielsen-ninomiya-by-stokes",
      "oracle_id": "question_oracle:prove-nielsen-ninomiya-by-stokes",
      "grade": "partial",
      "notes": "The local theorem proof is explicit, but the stronger Friedan cited-paper route is still unresolved.",
      "writeback_unit_ids": [
        "open_gap:friedan-level-rigorous-nielsen-ninomiya-proof-not-yet-ingested",
        "followup_source_task:ingest-friedan-proof-of-nielsen-ninomiya"
      ]
    },
    {
      "question_id": "regression_question:explain-berry-flux-version-of-node-charge",
      "oracle_id": "question_oracle:explain-berry-flux-version-of-node-charge",
      "grade": "pass",
      "notes": "The Berry-curvature route to the node charge and zero-sum law is explicit."
    },
    {
      "question_id": "regression_question:separate-anomaly-intuition-from-lattice-proof",
      "oracle_id": "question_oracle:separate-anomaly-intuition-from-lattice-proof",
      "grade": "partial",
      "notes": "The local distinction is explicit, but the cited-source separation between anomaly intuition and lattice proof is still incomplete.",
      "writeback_unit_ids": [
        "open_gap:parity-anomaly-motivates-but-does-not-prove-lattice-no-go",
        "followup_source_task:ingest-friedan-proof-of-nielsen-ninomiya",
        "followup_source_task:ingest-callan-harvey-and-jackiw-rebbi-for-edge-mode-proof",
        "conflict_record:continuum-parity-anomaly-is-not-lattice-no-go"
      ]
    },
    {
      "question_id": "regression_question:identify-lecture-two-and-three-prerequisites-for-edge-mode-proof",
      "oracle_id": "question_oracle:identify-lecture-two-and-three-prerequisites-for-edge-mode-proof",
      "grade": "pass",
      "notes": "The KB now names the projector-formula TKNN bridge, the Jackiw-Rebbi zero-mode theorem, the anomaly-inflow theorem, and the residual narrowed enrichment routes explicitly."
    },
    {
      "question_id": "regression_question:justify-large-gauge-quantization-before-hall-response-equivalence",
      "oracle_id": "question_oracle:justify-large-gauge-quantization-before-hall-response-equivalence",
      "grade": "pass",
      "notes": "The large-gauge prerequisite proof is explicit through equation context and proof-obligation units."
    },
    {
      "question_id": "regression_question:reconstruct-hall-response-chern-number-equivalence",
      "oracle_id": "question_oracle:reconstruct-hall-response-chern-number-equivalence",
      "grade": "pass",
      "notes": "The response, projector-level TKNN, and many-body twist-angle routes are all explicit locally, so the flagship Lecture Two theorem is now source-grade in the current KB.",
      "writeback_unit_ids": [
        "theorem:integer-quantum-hall-response-equals-band-and-many-body-chern-number",
        "proof_fragment:projector-formula-for-the-tknn-chern-number",
        "proof_state:lecture-two-hall-response-chern-number",
        "source_fusion_record:hall-response-chern-number-cross-source-fusion"
      ]
    },
    {
      "question_id": "regression_question:separate-local-lecture-two-proof-from-cited-source-fusion-gap",
      "oracle_id": "question_oracle:separate-local-lecture-two-proof-from-cited-source-fusion-gap",
      "grade": "pass",
      "notes": "The KB cleanly separates the core source-grade Hall-response theorem from the narrower Haldane / archival-enrichment route."
    },
    {
      "question_id": "regression_question:derive-jackiw-rebbi-edge-mode-from-mass-sign-change",
      "oracle_id": "question_oracle:derive-jackiw-rebbi-edge-mode-from-mass-sign-change",
      "grade": "pass",
      "notes": "The parity-anomaly setup, Jackiw-Rebbi zero-mode theorem, anomaly-inflow interpretation, and wall-mode derivation are all explicit locally, so the flagship Lecture Three theorem is now source-grade in the current KB.",
      "writeback_unit_ids": [
        "theorem:jackiw-rebbi-zero-mode-for-sign-changing-dirac-mass",
        "theorem:anomaly-inflow-requires-chiral-edge-modes",
        "theorem:sign-changing-dirac-mass-supports-chiral-edge-mode",
        "proof_state:lecture-three-domain-wall-edge-mode"
      ]
    },
    {
      "question_id": "regression_question:derive-boundary-chirality-after-doubling-and-folding",
      "oracle_id": "question_oracle:derive-boundary-chirality-after-doubling-and-folding",
      "grade": "pass",
      "notes": "The full ordered derivation is explicit, and the final anomaly-inflow interpretation plus the continuum-versus-lattice scope boundary are both preserved.",
      "writeback_unit_ids": [
        "dependency_graph_snapshot:lecture-three-domain-wall-edge-mode-proof",
        "theorem:anomaly-inflow-requires-chiral-edge-modes",
        "theorem:jackiw-rebbi-zero-mode-for-sign-changing-dirac-mass",
        "conflict_record:continuum-parity-anomaly-is-not-lattice-no-go"
      ]
    },
    {
      "question_id": "regression_question:separate-local-edge-mode-proof-from-cited-source-fusion-gap",
      "oracle_id": "question_oracle:separate-local-edge-mode-proof-from-cited-source-fusion-gap",
      "grade": "pass",
      "notes": "The KB cleanly separates the source-grade continuum family from the narrower archival-enrichment route and from the distinct lattice no-go theorem."
    }
  ],
  "created_at": "2026-03-20"
}
